{
  "$schema": "https://json-schema.org/draft/2020-12/schema",
  "$id": "https://enest.local/schemas/registry.json",
  "title": "eNest plugin registry",
  "type": "object",
  "required": ["schemaVersion", "plugins"],
  "properties": {
    "schemaVersion": { "type": "integer", "const": 1 },
    "generatedAt": { "type": "string", "format": "date-time" },
    "channel": { "type": "string", "enum": ["stable", "beta", "dev"] },
    "categories": {
      "type": "array",
      "items": { "type": "string" }
    },
    "plugins": {
      "type": "array",
      "items": {
        "type": "object",
        "required": ["id", "name", "version", "category", "asset"],
        "properties": {
          "id": { "type": "string" },
          "name": { "type": "string" },
          "version": { "type": "string" },
          "description": { "type": "string" },
          "author": { "type": "string" },
          "category": { "type": "string" },
          "icon": { "type": "string" },
          "tags": { "type": "array", "items": { "type": "string" } },
          "permissions": { "type": "array", "items": { "type": "string" } },
          "featured": { "type": "boolean" },
          "installs": { "type": "number" },
          "asset": {
            "type": "object",
            "required": ["name", "url"],
            "properties": {
              "name": {
                "type": "string",
                "pattern": "^.+@\\d+\\.\\d+\\.\\d+.*\\.enestplugin$"
              },
              "url": { "type": "string" },
              "size": { "type": "number" },
              "sha256": { "type": "string" }
            }
          }
        }
      }
    }
  }
}
