{
  "schemaVersion": 1,
  "generatedAt": "2026-09-18T08:31:51.521Z",
  "channel": "stable",
  "categories": [
    "效率",
    "开发",
    "设计",
    "媒体",
    "其它"
  ],
  "plugins": [
    {
      "id": "com.enest.clipboard",
      "name": "粘贴板",
      "version": "1.0.0",
      "description": "剪贴板历史、图片回显与快速选中回写",
      "author": "eNest Labs",
      "category": "效率",
      "icon": "icons/com.enest.clipboard.svg",
      "tags": [
        "剪贴板",
        "历史",
        "效率"
      ],
      "permissions": [
        "clipboard.read",
        "clipboard.write",
        "clipboard.readImage",
        "clipboard.writeImage",
        "clipboard.history",
        "storage.local",
        "ui.setTitle",
        "ui.toast"
      ],
      "engines": {
        "enest": ">=0.1.0"
      },
      "featured": true,
      "installs": 0,
      "ui": {
        "chrome": "none",
        "themeAware": true,
        "background": "opaque",
        "preferredColorScheme": "auto"
      },
      "asset": {
        "name": "com.enest.clipboard@1.0.0.enestplugin",
        "url": "com.enest.clipboard@1.0.0.enestplugin",
        "size": 0,
        "sha256": ""
      }
    },
    {
      "id": "com.enest.database",
      "name": "数据库",
      "version": "1.0.0",
      "description": "桌面级 SQL 客户端：连接管理、IDEA 式补全、结果集增删改批、控制台会话持久化",
      "author": "eNest Labs",
      "category": "开发",
      "icon": "icons/com.enest.database.svg",
      "tags": [
        "数据库",
        "SQL",
        "开发",
        "MySQL",
        "SQLite"
      ],
      "permissions": [
        "vault.write",
        "db.connect",
        "db.query",
        "db.schema",
        "storage.local",
        "ui.setTitle",
        "ui.toast",
        "notify",
        "clipboard.write",
        "shell.openExternal",
        "settings.register"
      ],
      "engines": {
        "enest": ">=0.1.0"
      },
      "featured": true,
      "installs": 0,
      "ui": {
        "chrome": "none",
        "themeAware": true,
        "background": "opaque",
        "preferredColorScheme": "auto"
      },
      "asset": {
        "name": "com.enest.database@1.0.0.enestplugin",
        "url": "com.enest.database@1.0.0.enestplugin",
        "size": 0,
        "sha256": ""
      }
    },
    {
      "id": "com.enest.screen-assistant",
      "name": "屏幕助手",
      "version": "1.0.0",
      "description": "矩形截图、矩形录屏（可选声音）与截图贴到屏幕",
      "author": "eNest Labs",
      "category": "媒体",
      "icon": "icons/com.enest.screen-assistant.svg",
      "tags": [
        "截图",
        "录屏",
        "贴图"
      ],
      "permissions": [
        "screen.capture",
        "screen.record",
        "pin.create",
        "clipboard.writeImage",
        "storage.local",
        "ui.setTitle",
        "ui.toast"
      ],
      "engines": {
        "enest": ">=0.1.0"
      },
      "featured": true,
      "installs": 0,
      "ui": {
        "chrome": "none",
        "themeAware": true,
        "background": "opaque",
        "preferredColorScheme": "auto"
      },
      "asset": {
        "name": "com.enest.screen-assistant@1.0.0.enestplugin",
        "url": "com.enest.screen-assistant@1.0.0.enestplugin",
        "size": 0,
        "sha256": ""
      }
    },
    {
      "id": "com.enest.ssh",
      "name": "SSH管理",
      "version": "1.0.0",
      "description": "生产级 SSH 客户端：连接资产库、交互终端、命令补全、历史片段、性能监控与最小 SFTP",
      "author": "eNest Labs",
      "category": "开发",
      "icon": "icons/com.enest.ssh.svg",
      "tags": [
        "SSH",
        "终端",
        "运维",
        "开发",
        "SFTP"
      ],
      "permissions": [
        "vault.write",
        "ssh.session",
        "ssh.exec",
        "ssh.sftp",
        "storage.local",
        "ui.setTitle",
        "ui.toast",
        "notify",
        "clipboard.write",
        "shell.openExternal",
        "settings.register"
      ],
      "engines": {
        "enest": ">=0.1.0"
      },
      "featured": true,
      "installs": 0,
      "ui": {
        "chrome": "none",
        "themeAware": true,
        "background": "opaque",
        "preferredColorScheme": "auto"
      },
      "asset": {
        "name": "com.enest.ssh@1.0.0.enestplugin",
        "url": "com.enest.ssh@1.0.0.enestplugin",
        "size": 0,
        "sha256": ""
      }
    },
    {
      "id": "com.enest.translate",
      "name": "翻译",
      "version": "1.0.0",
      "description": "谷歌翻译引擎，自动检测语言，一键复制译文",
      "author": "Lingua",
      "category": "效率",
      "icon": "icons/com.enest.translate.svg",
      "tags": [
        "翻译",
        "谷歌",
        "效率"
      ],
      "permissions": [
        "net.fetch",
        "clipboard.read",
        "clipboard.write",
        "storage.local",
        "ui.setTitle",
        "ui.toast"
      ],
      "engines": {
        "enest": ">=0.1.0"
      },
      "featured": true,
      "installs": 0,
      "ui": {
        "chrome": "none",
        "themeAware": true,
        "background": "opaque",
        "preferredColorScheme": "auto"
      },
      "asset": {
        "name": "com.enest.translate@1.0.0.enestplugin",
        "url": "com.enest.translate@1.0.0.enestplugin",
        "size": 0,
        "sha256": ""
      }
    },
    {
      "id": "com.example.hello",
      "name": "Hello 示例",
      "version": "1.0.0",
      "description": "eNest 标准插件骨架：manifest + 静态资源 + 全幅渲染。",
      "author": "eNest",
      "category": "效率",
      "icon": "icons/com.example.hello.svg",
      "tags": [
        "示例",
        "入门"
      ],
      "permissions": [
        "storage.local",
        "ui.setTitle",
        "ui.toast",
        "contribute",
        "settings.register"
      ],
      "engines": {
        "enest": ">=0.1.0"
      },
      "featured": false,
      "installs": 0,
      "ui": {
        "chrome": "none",
        "themeAware": true,
        "background": "opaque",
        "preferredColorScheme": "auto"
      },
      "asset": {
        "name": "com.example.hello@1.0.0.enestplugin",
        "url": "com.example.hello@1.0.0.enestplugin",
        "size": 0,
        "sha256": ""
      }
    }
  ]
}
